{
  "schema_version": "proof-lab-source-lock-v1",
  "lock_status": "incomplete",
  "title": "A Closer Look at the Russell Paradox",
  "author": "Flash Sheridan",
  "scope": {
    "sections": ["2", "3", "4", "5", "6"],
    "locator_convention": null
  },
  "sources": [
    {
      "id": "sheridan-published-2023",
      "role": "bibliographic-and-numbering-authority",
      "publication": "Logique et Analyse 262 (2023), 125-146",
      "doi": "10.2143/LEA.262.0.3293616",
      "canonical_url": "https://poj.peeters-leuven.be/content.php?id=3293616&journal_code=LEA&url=article",
      "retrieved_at": null,
      "media_type": null,
      "byte_length": null,
      "sha256": null
    },
    {
      "id": "sheridan-arxiv-2103.00090v5",
      "role": "candidate-formalization-basis",
      "arxiv_id": "2103.00090",
      "version": "v5",
      "revision_date": "2024-05-27",
      "canonical_url": "https://arxiv.org/pdf/2103.00090v5",
      "retrieved_at": null,
      "media_type": "application/pdf",
      "byte_length": null,
      "sha256": null
    }
  ],
  "comparison": {
    "sections_compared": [],
    "status": "not-started",
    "differences": []
  }
}
